Title,Tags,Votes,Timestamp,User ID
Audio intermitency js,"javascript, html, audio, audio-streaming, web-audio-api",0,2024-09-20 16:39:27Z,11957546
Odoo Snippet Not Visible in Website Builder After Module Installation,"javascript, python-3.x, odoo, qweb, odoo-16",0,2024-09-20 16:35:44Z,25666611
"How do I create a userscript that creates a button on a webpage, that when clicked, runs the GM_registerMenuCommand for that userscript?","javascript, button, userscripts, violentmonkey",-1,2024-09-20 16:32:22Z,22003790
Tabs not aligned in Bootstrap Modal,"javascript, html, css, bootstrap-4, modal-dialog",0,2024-09-20 15:58:43Z,27394237
Is there a way to make a different function happen after every single click on the document in js?,"javascript, html",0,2024-09-20 15:11:22Z,26576287
setInterval and clearInterval in React (stopwatch) [closed],"javascript, react-native, setinterval, clearinterval",-3,2024-09-20 15:08:42Z,27393691
highcharts tree graph panning and zoom in and out,"javascript, html, jquery, css, highcharts",0,2024-09-20 15:07:23Z,23273760
Spotify Web API redirect user back to the app after log out [duplicate],"javascript, node.js, authentication, spotify",0,2024-09-20 15:06:46Z,21127165
Unable to Track New Files and Folders in Git with VS Code,"javascript, html, css, git, github",-1,2024-09-20 14:55:27Z,24946838
How to correctly handle issues with incorrect rotation axes after multiple CSS rotate transformations,"javascript, css, reactjs",0,2024-09-20 14:54:50Z,27387152
Unable to write to the file [closed],"javascript, node.js",-2,2024-09-20 14:43:29Z,11445172
Google OAuth 2.0 issues,"javascript, reactjs, node.js, express, google-oauth",0,2024-09-20 14:27:16Z,20494649
"Save Contact with vcf works on mac, but not on iPhone","javascript, reactjs, vcf-vcard, vcftools",0,2024-09-20 14:21:48Z,7942553
How does FlatList rendering items with same names work?,"javascript, html, css, reactjs, react-native",0,2024-09-20 14:16:31Z,21584043
Browser EventLoop prevents window load event from firing when advanced by an async substlecrypto call,"javascript, ecmascript-6, subtlecrypto",1,2024-09-20 14:07:02Z,26539552
Static Route Triggering Dynamic Parallel Route in Next.js,"javascript, reactjs, next.js, nextjs14",0,2024-09-20 14:05:47Z,2313113
ERPNext Query & Script code Problem for Report,"javascript, python, report, erpnext",0,2024-09-20 13:40:48Z,27391380
Heap out of memory Angular Ckeditor 5,"javascript, angular, typescript, ckeditor, ckeditor5",0,2024-09-20 13:31:48Z,13767935
Redux mockStore - Data not passing in component,"javascript, reactjs, jestjs, react-testing-library, redux-mock-store",0,2024-09-20 13:13:50Z,15181085
Compare string with day and month of date,"javascript, jquery, css, calendar",0,2024-09-20 13:11:46Z,4469993
Show/hide some text in larger text,"javascript, html, css",1,2024-09-20 13:05:57Z,5058384
Scale rotated SVGelements,"javascript, svg",1,2024-09-20 12:57:01Z,4728913
How to force UI draw in ElectronJS prior to intense computation task?,"javascript, electron",0,2024-09-20 12:51:12Z,2721846
Adjacent Plot with Shared Y-axis in Scichart JS,"javascript, scichart",0,2024-09-20 12:45:13Z,4555763
Using useEffect takes time to load and not using it leads to render the component twice,"javascript, reactjs, typescript, tsx",0,2024-09-20 12:41:04Z,17448458
Why spreading array is required in angular application? [duplicate],"javascript, angular",0,2024-09-20 12:30:35Z,5777370
Is assignment in Javascript template literals allowed?,javascript,0,2024-09-20 12:28:44Z,351162
Change Boolean value in child component,"javascript, vue.js",0,2024-09-20 12:25:52Z,4349227
Can't get Jest tests to run with reactotron-redux with the following error - SyntaxError: Cannot use import statement outside a module,"javascript, react-native, jestjs, reactotron",0,2024-09-20 12:19:39Z,8618818
Local file path to File/Blob to be read by SheetJS's read function [duplicate],"javascript, sheetjs",0,2024-09-20 11:32:40Z,9084289
Retry request until API returns proper value then continue with further requests,"javascript, postman, postman-collection-runner",0,2024-09-20 11:31:33Z,16493592
How not to re-render the canvas once state changes?,"javascript, reactjs, p5.js",0,2024-09-20 11:29:22Z,10489887
What is the alternative API for Safari iOS for 'webRequest.onBeforeRequest' since this API is not available on Safari iOS?,", javascript, ios, swift, mobile-safari",0,2024-09-20 11:12:12Z,27391179
Uncaught TypeError: number 0 is not iterable (cannot read property Symbol(Symbol.iterator)),"javascript, reactjs, typescript, material-ui, mui-app-bar",0,2024-09-20 11:11:44Z,16876542
"Inconsistent window.scrollTo(0, 0) Behavior","javascript, html, npm, barbajs",0,2024-09-20 11:00:19Z,21888413
How to clip curvedText in fabricjs version 5?,"javascript, fabricjs, fabricjs2",0,2024-09-20 10:50:39Z,9671590
How to exit process.stdin.on without exiting the entire program?,"javascript, node.js, process, stdin, readline",0,2024-09-20 10:17:42Z,11315745
How to test a Redux component the right way?,"javascript, reactjs, redux, jestjs, react-testing-library",-1,2024-09-20 10:11:19Z,23916759
how to make the text in the items to float above the image in SwipeJS?,"javascript, html, css, carousel, swipe",1,2024-09-20 10:06:56Z,1235167
Next Page is not loading and setting values in Suitelet Page,"javascript, netsuite, suitescript2.0",0,2024-09-20 09:56:54Z,19443460
How to display a new table (2) after click on row table (1) for view details [closed],", javascript, php, html, ajax",-3,2024-09-20 09:48:27Z,27351723
TinyMCE 7.3.0 - DOM error on editor destroy,"javascript, dom, tinymce",0,2024-09-20 09:29:13Z,8216548
"Jest testing error: TypeError: (0 , import_redux2.combineReducers) is not a function","javascript, reactjs, jestjs, react-testing-library, redux-toolkit",0,2024-09-20 09:29:12Z,27390274
Who can explain this weird inference in TypeScript?,"javascript, node.js, typescript, ecmascript-6, babeljs",1,2024-09-20 09:04:53Z,972197
Display of image sequences in Webbrowser using VueJs,"javascript, image, vue.js",0,2024-09-20 08:58:25Z,1210977
Validation with alpine.js,"javascript, alpine.js",0,2024-09-20 08:43:36Z,15552873
sending Post request to oracle sql using AJAX (no PHP used in project) [duplicate],"javascript, html, jquery, ajax, spring-boot",0,2024-09-20 08:42:30Z,14741821
Retrieving data for Power Apps Person Card from MS GraphAPI,", javascript, html, azure-active-directory, liquid, power-pages",0,2024-09-20 08:40:25Z,27175176
Unable to reopen YouTube iframe embed full screen after open-exit full screen mod fast,"javascript, html, video, iframe, youtube",0,2024-09-20 08:36:37Z,25735285
How to show a component as a popup on first visit using React and localStorage?,"javascript, reactjs, jsx",1,2024-09-20 08:02:46Z,25037561
SyntaxError: Unexpected token in JSON.parse - Invalid JSON format being sent in to the Backend,"javascript, reactjs, node.js, json, typescript",-2,2024-09-20 07:44:01Z,20567004
Functions written inside the File not getting mocked in Node js Test case,"javascript, reactjs, node.js, unit-testing, jestjs",0,2024-09-20 07:36:37Z,9141308
Non-async function call inside an async function,"javascript, reactjs, async-await",0,2024-09-20 07:36:13Z,22490316
Document doesn't get deleted after expiration,"javascript, node.js, mongodb, mongoose",0,2024-09-20 07:35:54Z,23603116
vue3.5 Pass a value to a child component but the child component has not yet been mounted,"javascript, vuejs3, vue-component, vue-props",0,2024-09-20 07:22:29Z,25033642
The centers of the arrow tails on my Leaflet markers are misaligned,"javascript, leaflet",0,2024-09-20 07:09:26Z,15253574
JavaScript - for Loop [closed],"javascript, loops, for-loop, variables",-2,2024-09-20 07:03:34Z,21772878
how to handle seperate FormData in the replicated form?,"javascript, html, jquery, forms, modal-dialog",0,2024-09-20 06:17:49Z,11962700
"Why callback function showing ""Undefined"" result?","javascript, function, callback, automated-tests, postman",-4,2024-09-20 06:11:33Z,26857119
"React Native Firebase: realtime database listener and set data, push notification no longer triggers",", javascript, firebase, react-native, firebase-realtime-database",0,2024-09-20 06:06:16Z,27375372
Error: Exported bands must have compatible data types; found inconsistent types: Float64 and Float32. (Error code: 3),"javascript, google-earth-engine",1,2024-09-20 05:13:53Z,25158144
Error [ERR_STREAM_WRITE_AFTER_END]: write after end (NodeJS),"javascript, node.js",0,2024-09-20 05:05:28Z,13806428
EJS Rendering Issue: Status Column Value Not Displaying from MySQL Query,"javascript, node.js",0,2024-09-20 04:47:46Z,20850363
How to check a scroll-to button in Cypress?,"javascript, cypress",0,2024-09-20 04:39:34Z,1433268
AdminJS not overriding default dashboard with custom React component,"javascript, reactjs, adminjs",0,2024-09-20 04:08:54Z,15881586
Page not refreshing after task creation/update,"javascript, typescript, next.js, drizzle",0,2024-09-20 03:42:45Z,21692833
Create dynamically IDs in html form when add a new element and pass then .on change function,"javascript, html, jquery, dom",1,2024-09-20 03:38:24Z,27381438
"Using appwrite, with error: 'Cannot use import statement outside a module' [duplicate]","javascript, es6-modules",-5,2024-09-20 03:18:46Z,27387132
What is the Regex for mm/dd/yy format that includes single digit months and days? [closed],"javascript, regex, cypress",-2,2024-09-20 03:01:29Z,10791576
Recording audio in Unity WebGL game,"javascript, unity-game-engine, audio",2,2024-09-20 02:13:56Z,27386219
Load title tilts one after the other and asset animations on load,"javascript, reactjs",0,2024-09-20 01:56:11Z,2700673
Web Bluetooth characteristicvaluechanged not triggered in Android Chrome but works in Desktop Chrome,"javascript, google-chrome, bluetooth, android-chrome",0,2024-09-20 01:23:26Z,3915246
"eval JavaScript function works only when copied, pasted and run first in Developer console using chrome Developer tools [closed]","javascript, developer-tools",-2,2024-09-20 01:20:31Z,16592566
How to select the last record for each record type in a MongoDB with typescript and mongoose,"javascript, typescript, mongodb, mongoose",0,2024-09-20 00:58:15Z,2656421
React router dom 6.22 multiple level nested children routes index page not rendering [duplicate],"javascript, reactjs, react-router, react-router-dom",1,2024-09-20 00:15:24Z,7344314
How to have eCharts tooltip fully visible in the page with Bootstrap,"javascript, html, tooltip, bootstrap-5, echarts",1,2024-09-19 23:59:19Z,27160653
I was wondering if this JavaScript piece of code is ok [closed],javascript,-4,2024-09-19 23:10:07Z,27385871
Issue with CORS when hitting API using LangChain.js with MERN stack [duplicate],"javascript, cors, mern, gemini, langchain-js",-2,2024-09-19 22:33:28Z,22011873
"Get referral code from telegram bot start parameter with JavaScript landing page, and send to Laravel backend","javascript, laravel, telegram-bot",-1,2024-09-19 22:33:13Z,20060437
Is there a way I can reuse a toggle function for a list of navigation items that have a drop down when clicked?,"javascript, html, frontend",0,2024-09-19 22:25:51Z,15713217
How to simulate a terminal for the command ‘kubectl exec -ti blablabla’ on the client side,", javascript, kubernetes, websocket, amazon-eks, kubectl",0,2024-09-19 22:14:27Z,27385336
Storybook with Next.js and Webpack 5 cannot resolve various node modules,"javascript, node.js, webpack, storybook",0,2024-09-19 22:01:59Z,19019306
How to dynamically retrieve the content text of a HTML tag and its child tags?,"javascript, html, dom, html-select, innerhtml",1,2024-09-19 21:38:17Z,14408333
Discord.js fs.writeFile not updating the correct json,"javascript, node.js, discord.js, node.js-fs",0,2024-09-19 21:21:48Z,27385065
"how can i get all of sabre hotel images, not all area returning images only logo [closed]","javascript, image, sabre, booking.com-api, spring-cloud-sleuth-otel",-2,2024-09-19 21:20:25Z,21731718
PHP code issue causing grid container and bootstrap 5 cards (grid-items) not to render on web-page loading?,", javascript, php, html, mysql, bootstrap-5",1,2024-09-19 21:15:40Z,7167667
How to update map coordinates after zooming in Leaflet?,javascript,1,2024-09-19 21:10:44Z,27385149
How to clear the polylines when the itinerary change?,"javascript, google-maps, google-maps-api-3",0,2024-09-19 21:07:40Z,27385136
"POST request works fine in devtools, but not on the website [closed]","javascript, node.js, rest, post, cors",-4,2024-09-19 21:06:57Z,26792322
Upload document into Flowise AI via API endpoint,"javascript, reactjs, upsert, flowise",0,2024-09-19 21:02:26Z,3583669
mock.module is undefined in Node.js v22.9.0 node:test module,"javascript, node.js, node-test-runner",0,2024-09-19 21:01:34Z,888469
npm install is giving error - npm error ERESOLVE unable to resolve dependency tree,"javascript, typescript, react-native, jestjs, eslint",0,2024-09-19 20:54:09Z,21414353
What is different in my Ajax vs XMLHttpRequest Call that lets my Server understand Ajax but not XMLHttpRequest?,"javascript, c#, ajax, asp.net-core, xmlhttprequest",-1,2024-09-19 20:50:02Z,2371128
Highchart vertical and horizontal scrollbar,"javascript, html, css, highcharts",0,2024-09-19 20:40:15Z,23273760
Chart JS Curved Labels in Polar Area,"javascript, charts, chart.js",0,2024-09-19 20:37:26Z,14774544
Dynamic audio rendering with tone.js,"javascript, tonejs",0,2024-09-19 20:22:21Z,1309776
The request failed to reach my Django view,"javascript, python, django",0,2024-09-19 20:19:33Z,27384890
Pass cookie to a fetch request on a different subdmain,"javascript, cookies, axios, fetch-api, httponly",0,2024-09-19 20:12:08Z,2399035
How to know what graph are you referring with multiple eCharts graphs in one page with `renderItem` callback,"javascript, callback, echarts",1,2024-09-19 19:47:52Z,27160653
Prop is usable in template but not in script,"javascript, vue.js",0,2024-09-19 19:33:27Z,4349227
